Rank,Author,Score,Students
1467,"Eddy  Omey Faculteit Economie en Bedrijfskunde, Universiteit Gent, Gent, Belgium",1553.93,1
1468,"Morley  Gunderson Department of Economics, University of Toronto, Toronto, Canada",1555.18,2
1469,"Angela  Redish Vancouver School of Economics, University of British Columbia, Vancouver, Canada",1556.38,2
1470,"Jarle  Moen Institutt for foretaksøkonomi, Norges Handelshøyskole (NHH), Bergen, Norway",1557.33,2.5
1471,"Maurice David Levi Sauder School of Business, University of British Columbia, Vancouver, Canada",1558.5,1
1472,"William F. Shughart IIDepartment of Economics and Finance, Jon M. Huntsman School of Business, Utah State University, Logan, Utah (USA)",1558.85,1
1473,Giancarlo  Marini †,1561.06,1
1474,"Miguel-Angel  Lopez-Garcia Departament d'Economia Aplicada, Universitat Autònoma de Barcelona, Barcelona, Spain",1561.64,1
1475,"Jean-Yves  Duclos Centre de Recherche sur les Risques, les Enjeux Économiques et les Politiques Publiques (CRREP), Montréal/Québec, CanadaDépartement d'Économique, Université Laval, Québec, Canada",1561.67,1
1476,"Jay Pil Choi Economics Department, Michigan State University, East Lansing, Michigan (USA)",1562.2,2
1477,"Dimitri  Vayanos Finance Department, London School of Economics (LSE), London, United Kingdom",1562.55,0.5
1478,"Maija  Halonen-Akatwijuka School of Economics, Finance and Management, University of Bristol, Bristol, United Kingdom",1562.78,1
1479,"Tomas J Philipson Harris School of Public Policy, University of Chicago, Chicago, Illinois (USA)",1566.82,1
1480,"Ronan  Powell Michael Smurfit Graduate School of Business, School of Business, University College Dublin, Dublin, Ireland",1567.86,1
1481,"Christina Duckworth Romer Department of Economics, University of California-Berkeley, Berkeley, California (USA)",1568.12,1.5
1482,"Brian S. Ferguson Department of Economics and Finance, Gordon Lang School of Business and Economics, University of Guelph, Guelph, Canada",1570.06,2
1483,"Timothy  Vogelsang Economics Department, Michigan State University, East Lansing, Michigan (USA)",1570.15,2
1484,"Michael  Spagat Department of Economics, Royal Holloway, Egham, United Kingdom",1571.98,0.5
1485,"Giorgio  Calzolari Dipartimento di Statistica, Informatica, Applicazioni ""G. Parenti"", Scuola di Economia e Management, Università degli Studi di Firenze, Firenze, Italy",1574.46,0.5
1486,"Brigitte Simone Dormont Laboratoire d'Économie et de Gestion des Organisations de la Santé (LÉGOS), Laboratoire d'Économie de Dauphine (LEDa), Université Paris-Dauphine (Paris IX), Paris, France",1574.64,2
1486,"Christopher  Worswick Department of Economics, Carleton University, Ottawa, Canada",1574.64,1
1488,Irina A. Telyukova,1577.14,1
1489,"Piero  Gottardi Economics Department, University of Essex, Colchester, United Kingdom",1578.68,2.5
1490,"Keith  Ihlanfeldt Department of Economics, Florida State University, Tallahassee, Florida (USA)",1579.11,3
1491,"Stefan  Gerlach Central Bank of Ireland, Dublin, Ireland",1580.4,0.5
1492,"Stephen F. LeRoy Department of Economics, University of California-Santa Barbara (UCSB), Santa Barbara, California (USA)",1580.83,1
1493,"Thomas  Chaney Department of Economics, Sciences économiques, Sciences Po, Paris, France",1581.08,1
1494,"Rodney  Tyers Business School, University of Western Australia, Perth, Australia",1581.68,1
1495,"Mustafa  Caglayan Department of Accountancy, Economics and Finance, Heriot-Watt University, Edinburgh, United Kingdom",1582.39,2
1496,"Agar  Brugiavini Scuola Superiore di Economia (SSE-Ca' Foscari), Venezia, Italy",1583.57,2
1497,"Guido  Tabellini Innocenzo Gasparini Institute for Economic Research (IGIER), Università Commerciale Luigi Bocconi, Milano, Italy",1584.04,1
1498,"Sebastien  Jean Centre d'études prospectives et d'informations internationales (CEPII), Paris, France",1584.79,1.5
1499,"Alfredo Marvao Pereira Department of Economics, College of William and Mary, Williamsburg, Virginia (USA)",1585.06,1
1500,"Brian J. Loasby Economics Division, Stirling Management School, University of Stirling, Stirling, United Kingdom",1588.89,1
1501,"George-Marios  Angeletos Economics Department, Massachusetts Institute of Technology (MIT), Cambridge, Massachusetts (USA)",1589.78,1
1502,"Bill  Dupor Research Division, Federal Reserve Bank of St. Louis, St. Louis, Missouri (USA)",1590.18,3
1503,"Luciano  Fanti Dipartimento di Economia e Management, Università degli Studi di Pisa, Pisa, Italy",1594.7,1
1504,John Earl Floyd,1595.3,1.5
1505,"Christian  Montet Centre d'Économie de l'Environnement - Montpellier (CEE-M), Faculté de sciences économiques, Université de Montpellier, Montpellier, France",1597.65,3
1506,Benoit B. Mandelbrot †,1597.81,0.5
1507,"Huw  Lloyd-Ellis Economics Department, Queen's University, Kingston, Canada",1598.08,4
1508,"Mikolaj  Czajkowski Wydział Nauk Ekonomicznych, Uniwersytet Warszawski, Warszawa, Poland",1598.36,5
1509,"Pierre-Philippe  Combes Groupe d'Analyse et de Théorie Économique Lyon St-Étienne (GATE Lyon St-Étienne), Université de Lyon, Lyon, FranceDepartment of Economics, Sciences économiques, Sciences Po, Paris, France",1601.12,2
1510,"Steven J. Haider Economics Department, Michigan State University, East Lansing, Michigan (USA)",1601.67,2.5
1511,"Alexander  Ludwig Leibniz-Institut für Finanzmarktforschung SAFE (Sustainable Architecture for Finance in Europe), Germany",1602.01,0.5
1512,Paul Charles Cheshire,1602.36,1
1513,"Franz  Hackl Institut für Volkswirtschaftslehre, Johannes-Kepler-Universität Linz, Linz, AustriaAustrian Center for Labor Economics and the Analysis of the Welfare State, Johannes-Kepler-Universität Linz, Linz, Austria",1602.51,0.5
1514,"Ricardo  Lagos Department of Economics, New York University (NYU), New York City, New York (USA)",1602.71,1.5
1515,"Lubomir Mirek Lizal Katedra Ekonomiky, Manažerství a Humanitních věd, Fakulta Elektrotechnická, České Vysoké UČení Technické v Praze, Praha, Czech Republic",1604.09,4
1516,"Bernardo  Guimaraes Escola de Economia de São Paulo (EESP), Fundação Getúlio Vargas (FGV), São Paulo, Brazil",1605.6,5
1517,"Roel Maria Wilhelmus Jozef Beetsma Faculteit Economie en Bedrijfskunde, Universiteit van Amsterdam, Amsterdam, Netherlands",1606.63,1
1518,"Isaac  Ehrlich Department of Economics, State University of New York-Buffalo (SUNY), Buffalo, New York (USA)",1606.96,2
1519,"Pedro Pita Barros School of Business and Economics, Universidade Nova de Lisboa, Lisboa, Portugal",1608.92,1
1520,"Spiro E Stefanou Food and Resource Economics Department, University of Florida, Gainesville, Florida (USA)",1610.66,4
1521,"Jayson L. Lusk Department of Agricultural Economics, Purdue University, West Lafayette, Indiana (USA)",1612.28,4
1522,"Stephen A. Woodbury Economics Department, Michigan State University, East Lansing, Michigan (USA)",1613.11,3
1523,"Klaus  Desmet Department of Economics, Southern Methodist University, Dallas, Texas (USA)",1613.64,4
1524,"Stan  Du Plessis Department of Economics, Fakulteit Ekonomiese en Bestuurswetenskappe, University of Stellenbosch, Stellenbosch, South Africa",1615.09,1.5
1525,"Naci H. Mocan Department of Economics, Ourso College of Business, Louisiana State University, Baton Rouge, Louisiana (USA)",1616.7,9
1526,"Aldo  Rustichini Department of Economics, University of Minnesota, Minneapolis, Minnesota (USA)",1617.34,3
1527,"Richard Asher Chisik Department of Economics, Ryerson University, Toronto, Canada",1617.43,5
1528,"Jean-Francois  Laslier Paris School of Economics, Paris, France",1617.62,5
1529,Jean-Louis  Rulliere,1617.69,0.5
1530,"Deirdre N. McCloskey Department of Economics, University of Illinois at Chicago, Chicago, Illinois (USA)",1618.54,1.5
1531,"Ronni  Pavan Economics Department, University of Rochester, Rochester, New York (USA)",1618.82,2.5
1532,"Susanne M. Schennach Economics Department, Brown University, Providence, Rhode Island (USA)",1619.35,2.5
1533,"Yves  Zenou Department of Economics, Monash Business School, Monash University, Melbourne, Australia",1619.52,0.5
1534,"Richard E. Wagner Economics Department, George Mason University, Fairfax, Virginia (USA)",1621.03,1
1535,"Theodore  Palivos Department of Economics, Athens University of Economics and Business (AUEB), Athens, Greece",1622.71,1
1536,Mark  Killingsworth,1623.94,0.5
1537,"Franck  Portier Department of Economics, University College London (UCL), London, United Kingdom",1624.93,2.5
1538,"Rainer  Winkelmann Institut für Volkswirtschaftslehre, Wirtschaftswissenschaftliche Fakutät, Universität Zürich, Zürich, Switzerland",1625.44,1
1539,"Alexander K. Karaivanov Department of Economics, Simon Fraser University, Burnaby, Canada",1625.65,4
1540,"Faiz  Gallouj Centre Lillois d'Études et de Recherches Économiques et Sociologiques (CLERSE), Faculty of Economics and Social Sciences, Université de Lille, Lille, France",1627.7,1
1541,"Carl-Johan  Dalgaard Økonomisk Institut, Københavns Universitet, København, Denmark",1632.74,1
1542,"Dominique  Henriet Groupement de Recherche en Économie Quantitative d'Aix-Marseille (GREQAM), École d'Économie d'Aix-Marseille, Aix-Marseille Université, Marseille, France",1635.4,1.5
1543,"Francesca  Lotti Banca d'Italia, Roma, Italy",1637,1.5
1543,"Franco  Donzelli Dipartimento di Economia, Management e Metodi Quantitativi (DEMM), Università degli Studi di Milano, Milano, Italy",1637,1
1545,"Badi H. Baltagi Department of Economics, Maxwell School, Syracuse University, Syracuse, New York (USA)",1637.55,1
1546,"Luc  Lauwers Centrum voor Economische Studiën, Faculteit Economie en Bedrijfswetenschappen, KU Leuven, Leuven, Belgium",1637.83,1
1547,"Steven  Lehrer Economics Department, Queen's University, Kingston, Canada",1640.86,1.5
1548,"Juan Carlos  Conesa Economics Department, Stony Brook University - SUNY, Stony Brook, New York (USA)",1641.58,3
1549,"Fabrizio  Coricelli Paris School of Economics, Paris, France",1642.13,3.5
1550,"Wendy  Carlin Department of Economics, University College London (UCL), London, United Kingdom",1642.4,1
1551,"Martin James Browning Department of Economics, Oxford University, Oxford, United Kingdom",1643.51,1.5
1552,"Paul  Frijters Department of Social Policy, London School of Economics (LSE), London, United Kingdom",1646.54,3
1553,"Magne  Mogstad Department of Economics, University of Chicago, Chicago, Illinois (USA)",1647.99,1
1554,"Jan  Svejnar School of International and Public Affairs (SIPA), Columbia University, New York City, New York (USA)Center for Economic Research and Graduate Education and Economics Institute (CERGE-EI), Praha, Czech Republic",1648.7,1.5
1555,Thomas  Brenner,1649.26,1.5
1556,"Bibhas  Saha Business School, Durham University, Durham, United Kingdom",1653.85,1
1557,"Tim R.L. Fry School of Economics, Finance and Marketing, RMIT University, Melbourne, Australia",1654.06,0.5
1558,"Elizabeth  Caucutt Department of Economics, University of Western Ontario, London, Canada",1654.26,1
1559,"Joseph P. Kaboski Department of Economics, University of Notre Dame, South Bend, Indiana (USA)",1655.35,2
1560,"Muriel  Niederle Department of Economics, Stanford University, Stanford, California (USA)",1657.69,1
1561,"Rachel  Griffith School of Economics, University of Manchester, Manchester, United Kingdom",1657.74,1
1562,"Kyle  Bagwell Department of Economics, Stanford University, Stanford, California (USA)",1659.25,1
1563,"Jessica A. Wachter Finance Department, Wharton School of Business, University of Pennsylvania, Philadelphia, Pennsylvania (USA)",1661.26,0.5
1564,"Esben Sloth Andersen IKE Gruppen, Institut for Økonomi og Ledelse, Aalborg Universitet, Aalborg, Denmark",1661.46,1
1565,"Yair  Tauman Economics Department, Stony Brook University - SUNY, Stony Brook, New York (USA)School of Economics, Interdisciplinary Center (IDC), Herzliya, Israel",1661.95,4
1566,"Stephane  Villeneuve Institut d'Économie Industrielle (IDEI), Toulouse School of Economics (TSE), Toulouse, France",1662.21,1.5
1567,"Guido M. Kuersteiner Department of Economics, University of Maryland, College Park, Maryland (USA)",1662.54,1
1568,"John P. Haisken-DeNew Melbourne Institute of Applied Economic and Social Research (MIAESR), Faculty of Business and Economics, University of Melbourne, Melbourne, Australia",1662.83,1
1569,Abhay  Pethe,1663.02,1
1570,"Andrew F. Newman Department of Economics, Boston University, Boston, Massachusetts (USA)",1663.55,1
1571,"Jean-Marc  Bourgeon Économie Publique, Département ECOSOCIO - Économie et Sciences Sociales pour l'Agriculture, l'Alimentation et l'Environnement (SAE2), Institut National de Recherche pour l'Agriculture, l'Alimentation et l'Environnement (INRAE), Paris-Grignon, France",1663.95,1.5
1572,"Michael Peter Clements ICMA Centre for Financial Markets, Henley Business School, University of Reading, Reading, United Kingdom",1664.11,0.5
1573,"Jean-Marc  Falter Schweizerische Nationalbank (SNB), Bern/Zürich, Switzerland",1666.09,1
1574,"Jeroen C.J.M. van den Bergh Departament d'Economia i Història Econòmica, Universitat Autònoma de Barcelona, Barcelona Graduate School of Economics (Barcelona GSE), Barcelona, Spain",1666.46,1
1575,"Gerhard  Glomm Department of Economics, Indiana University, Bloomington, Indiana (USA)",1666.61,1
1576,"Olivier  Bargain Laboratoire d'Analyse et de Recherche Économiques et Finance Internationales (LAREFI), Université de Bordeaux, Bordeaux, France",1669.42,1.5
1577,"Xavier  Freixas Centre de Recerca en Economia Financera i Comptabilitat (CREFC), Departament d'Economia i Empresa, Universitat Pompeu Fabra, Barcelona Graduate School of Economics (Barcelona GSE), Barcelona, SpainCentre for Economic Policy Research (CEPR), London, United Kingdom",1669.59,1.5
1578,"Dominique Madeleine Guegan Centre d'Économie de la Sorbonne, Université Paris 1 (Panthéon-Sorbonne), Paris, France",1669.96,5
1579,"Marjan W. Hofkes Afdeling Ruimtelijke Economie, School of Business and Economics, Vrije Universiteit Amsterdam, Amsterdam, Netherlands",1670.67,2
1580,"Enrique  Sentana Centro de Estudios Monetarios y Financieros (CEMFI), Madrid, Spain",1677.27,2
1581,"Olivier  Scaillet Geneva School of Economics and Management, Université de Genève, Genève, SwitzerlandGeneva Finance Research Institute (GFRI), Université de Genève, Genève, Switzerland",1683.13,1.5
1582,Pierangelo  Garegnani †,1685.43,2
1583,"Kjell G  Salvanes Institutt for samfunnsøkonomi, Norges Handelshøyskole (NHH), Bergen, Norway",1685.88,1
1584,"Jacques  Cremer Institut d'Économie Industrielle (IDEI), Toulouse School of Economics (TSE), Toulouse, France",1686.01,2
1585,"Alvaro  Escribano Departamento de Economía, Universidad Carlos III de Madrid, Madrid, Spain",1687.97,1.5
1586,"Mauro  Gallegati Dipartimento di Management, Facoltà di Economia ""Giorgio Fuà"", Università Politecnica delle Marche, Ancona, Italy",1689.23,1.5
1587,"Edi  Karni Department of Economics, Johns Hopkins University, Baltimore, Maryland (USA)",1690.16,0.5
1588,"Bjorn A. Hansson Nationalekonomiska Institutionen, Ekonomihögskolan, Lunds Universitet, Lund, Sweden",1690.44,1
1589,"Charles Milton Kahn Department of Economics, University of Illinois at Urbana-Champaign, Urbana-Champaign, Illinois (USA)",1691.72,2
1590,"Jorgen W. Weibull Department of Economics, Handelshögskolan i Stockholm, Stockholm, Sweden",1691.84,1
1591,"Kevin Hjortshoj O'Rourke Economics, New York University Abu Dhabi, Abu Dhabi, United Arab Emirates",1691.86,2
1592,"Ellen R. McGrattan Department of Economics, University of Minnesota, Minneapolis, Minnesota (USA)",1694.43,2
1593,"Timothy  Dunne Department of Economics, University of Notre Dame, South Bend, Indiana (USA)",1694.63,1
1594,"Marcus J. Chambers Economics Department, University of Essex, Colchester, United Kingdom",1695.69,1
1595,"Bernard  Sinclair-Desgagne SKEMA Business School, Lille, France",1696.08,2
1596,"Carlos  Alos-Ferrer Institut für Volkswirtschaftslehre, Wirtschaftswissenschaftliche Fakutät, Universität Zürich, Zürich, Switzerland",1696.21,1.5
1597,Eric Michel Renault,1699.27,0.5
1598,"Friedel  Bolle Wirtschaftswissenschaftliche Fakultät, Europa-Universität Viadrina Frankfurt (Oder), Frankfurt an der Oder, Germany",1700.7,1
1599,"Alberto  Holly Institut d'Économie et de Management de la Santé (IEMS), Faculté des Hautes Études Commerciales (HEC), Université de Lausanne, Lausanne, SwitzerlandSchool of Business and Economics, Universidade Nova de Lisboa, Lisboa, Portugal",1700.89,2
1600,"Francisco  Penaranda Departament d'Economia i Empresa, Universitat Pompeu Fabra, Barcelona Graduate School of Economics (Barcelona GSE), Barcelona, SpainCentre de Recerca en Economia Financera i Comptabilitat (CREFC), Departament d'Economia i Empresa, Universitat Pompeu Fabra, Barcelona Graduate School of Economics (Barcelona GSE), Barcelona, Spain",1700.99,1
1601,"William  Neilson Department of Economics, College of Business, University of Tennessee-Knoxville, Knoxville, Tennessee (USA)",1701.17,2
1602,"Ananth  Seshadri Economics Department, University of Wisconsin-Madison, Madison, Wisconsin (USA)",1701.28,1
1603,"Stephen J. Trejo Department of Economics, University of Texas-Austin, Austin, Texas (USA)",1701.84,2.5
1604,"Jean-Pierre  Lachaud Centre d'Économie du Développement, Université de Bordeaux, Bordeaux, France",1702.2,1
1605,"Dan A. Black Harris School of Public Policy, University of Chicago, Chicago, Illinois (USA)",1702.35,1
1606,Thomas  Moutos,1704.33,1
1607,"Bruno  Decreuse Groupement de Recherche en Économie Quantitative d'Aix-Marseille (GREQAM), École d'Économie d'Aix-Marseille, Aix-Marseille Université, Marseille, France",1705.28,1.5
1608,"Steven L. Puller Department of Economics, Texas A&M University, College Station, Texas (USA)",1705.98,1
1609,"Oscar  Jorda Economic Research, Federal Reserve Bank of San Francisco, San Francisco, California (USA)",1706.42,1
1610,"Catherine Louise Kling Charles H. Dyson School of Applied Economics and Management, Cornell University, Ithaca, New York (USA)",1707.18,1.5
1611,"Micael  Castanheira European Centre for Advanced Research in Economics and Statistics (ECARES), Solvay Brussels School of Economics and Management, Université Libre de Bruxelles, Bruxelles, Belgium",1708.84,1
1612,"Valerie Ann Ramey Department of Economics, University of California-San Diego (UCSD), La Jolla, California (USA)",1709.22,1.5
1613,"Pierre  Dubois Toulouse School of Economics (TSE), Toulouse, France",1710.61,4.5
1614,"Estelle  Cantillon European Centre for Advanced Research in Economics and Statistics (ECARES), Solvay Brussels School of Economics and Management, Université Libre de Bruxelles, Bruxelles, Belgium",1711.84,3.5
1615,"Fredrik  Sjoholm Nationalekonomiska Institutionen, Ekonomihögskolan, Lunds Universitet, Lund, Sweden",1713.03,3
1616,"Kenneth W. Clements Department of Economics, Business School, University of Western Australia, Perth, Australia",1713.18,1.5
1617,"Sergio Horacio Lence Department of Economics, Iowa State University, Ames, Iowa (USA)",1715.47,1
1618,"David  Figlio Institute for Policy Research (IPR), Northwestern University, Evanston, Illinois (USA)",1717.52,1
1619,"Ben W. Smit Bureau for Economic Research, Fakulteit Ekonomiese en Bestuurswetenskappe, University of Stellenbosch, Stellenbosch, South Africa",1719.16,1
1620,"Zvi  Eckstein School of Economics, Interdisciplinary Center (IDC), Herzliya, Israel",1723.66,1
1621,Roberta  Capello,1723.77,1.5
1622,"Parimal  Patel Science Policy Research Unit (SPRU), Sussex Business School, University of Sussex, Brighton, United Kingdom",1724.66,0.5
1623,"Philippe  Quirion Centre International de Recherche sur l'Environnement et le Développement (CIRED), Paris, France",1728.25,4
1624,"Susana  Ferreira Department of Agricultural and Applied Economics, University of Georgia, Athens, Georgia (USA)",1728.7,2
1625,"Alain  Venditti Groupement de Recherche en Économie Quantitative d'Aix-Marseille (GREQAM), École d'Économie d'Aix-Marseille, Aix-Marseille Université, Marseille, France",1730.86,3
1626,"Mikhail  Chernov Finance Group, Anderson Graduate School of Management, University of California-Los Angeles (UCLA), Los Angeles, California (USA)National Bureau of Economic Research (NBER), Cambridge, Massachusetts (USA)",1731.26,1.5
1627,"Peter John Dolton Department of Economics, Sussex Business School, University of Sussex, Brighton, United Kingdom",1731.47,1.5
1628,"Jean-Bernard  Chatelain Paris School of Economics, Paris, France",1732.67,13.5
1628,"Andrew B. Bernard Tuck School of Business, Dartmouth College, Hanover, New Hampshire (USA)",1732.67,0.5
1630,"Peter E. Earl School of Economics, University of Queensland, Brisbane, Australia",1733.31,1
1631,"Lester Charles Hunt Economics and Finance Group, Portsmouth Business School, University of Portsmouth, Portsmouth, United Kingdom",1734.02,1
1632,"Pravin  Krishna International Economics Department, School of Advanced International Studies, Johns Hopkins University, Washington, District of Columbia (USA)",1734.6,2
1633,"Andy  McKay Department of Economics, Sussex Business School, University of Sussex, Brighton, United Kingdom",1734.63,5
1634,"Ulrich  Pfister Center for Quantitative Economics (CQE), Wirtschaftswissenschaftliche Fakultät, Westfälische Wilhelms-Universität Münster, Münster, Germany",1734.98,1
1635,"James  Peck Department of Economics, Ohio State University, Columbus, Ohio (USA)",1735.53,4
1636,"Andrzej  Skrzypacz Graduate School of Business, Stanford University, Stanford, California (USA)",1735.79,0.5
1637,"Daniele  Coen-Pirani Department of Economics, University of Pittsburgh, Pittsburgh, Pennsylvania (USA)",1736.06,1
1638,Michel  Le Breton,1736.65,1.5
1639,"Carlos  Herves-Beloso Facultade de Ciencias Económicas e Empresariais, Universidade de Vigo, Vigo, Spain",1737.03,1
1640,"Les  Oxley Department of Economics, Waikato Management School, University of Waikato, Hamilton, New Zealand",1737.58,1
1641,"Martin  Gervais Department of Economics, Terry College of Business, University of Georgia, Athens, Georgia (USA)",1738.05,2.5
1642,"James B. Ang Division of Economics, Nanyang Technological University, Singapore, Singapore",1740.53,3
1643,"Phillip  Leslie Anderson Graduate School of Management, University of California-Los Angeles (UCLA), Los Angeles, California (USA)",1740.55,0.5
1644,Tor Jakob Klette †,1741.05,0.5
1645,"Gilat  Levy Economics Department, London School of Economics (LSE), London, United Kingdom",1741.07,1.5
1646,"Guido  Cozzi Forschungsgemeinschaft für Nationalökonomie, School of Economics and Political Science, Universität St. Gallen, Sankt Gallen, Switzerland",1741.99,1.5
1647,"Jesus  Gonzalo Departamento de Economía, Universidad Carlos III de Madrid, Madrid, Spain",1742.27,0.5
1648,"Efe A. Ok Department of Economics, New York University (NYU), New York City, New York (USA)",1743.67,0.5
1649,"Javier  Fernandez-Macho Departamento de Economía Aplicada III (Econometría y Estadística), Facultad de Economía y Empresa, Universidad del País Vasco - Euskal Herriko Unibertsitatea, Bilbao, Spain",1745.52,2
1650,"Roberto  Tamborini Dipartimento di Economia e Management, Università degli Studi di Trento, Trento, Italy",1745.57,0.5
1651,"Erik Teodoor Verhoef Afdeling Ruimtelijke Economie, School of Business and Economics, Vrije Universiteit Amsterdam, Amsterdam, Netherlands",1747.74,2.5
1652,"Maik  Wolters Volkswirtschaftliches Institut, Wirtschaftswissenschaftliche Fakultät, Bayerische Julius-Maximilians-Universität Würzburg, Würzburg, Germany",1749.83,3
1653,"Kenzo  Abe Graduate School of Economics, Osaka University, Osaka, Japan",1750.43,1
1654,"Timothy Simon Worrall School of Economics, University of Edinburgh, Edinburgh, United Kingdom",1752.29,2.5
1655,"Pierpaolo  Battigalli Innocenzo Gasparini Institute for Economic Research (IGIER), Università Commerciale Luigi Bocconi, Milano, Italy",1755.32,1
1656,"Franco  Malerba Knowledge, Internationalization and Technology Studies (KITeS/CESPRI), Università Commerciale Luigi Bocconi, Milano, Italy",1756.24,1
1657,"Max  Gillman Department of Economics, University of Missouri-St. Louis, St. Louis, Missouri (USA)",1760,5
1658,"Carlo Luigi Bianchi Dipartimento di Economia e Management, Università degli Studi di Pisa, Pisa, Italy",1760.11,0.5
1659,"Patrick  Bolton Finance and Economics Department, Graduate School of Business, Columbia University, New York City, New York (USA)",1760.55,0.5
1660,"Sara  Markowitz Department of Economics, Emory University, Atlanta, Georgia (USA)",1761.41,2
1661,"Charles Peter Timmer Department of Economics, Harvard University, Cambridge, Massachusetts (USA)",1761.79,0.5
1662,"Sune  Karlsson Handelshögskolan, Örebro Universitet, Örebro, Sweden",1763.82,5
1663,"Stephen  Gordon Département d'Économique, Université Laval, Québec, Canada",1765.5,1
1664,"Tommy  Andersson Nationalekonomiska Institutionen, Ekonomihögskolan, Lunds Universitet, Lund, Sweden",1768.45,5
1665,Rigoberto  Perez,1769,2
1666,Douglas D. Purvis †,1769.89,1
1667,"Mario Rui Pascoa School of Economics, University of Surrey, Guildford, United Kingdom",1769.99,1.5
1668,Massimiliano  Marzo,1770.71,1
1669,"Pascal  St-Amour Départment d'économétrie et d'économie politique (DEEP), Faculté des Hautes Études Commerciales (HEC), Université de Lausanne, Lausanne, Switzerland",1770.88,1
1670,"Laurence  Kranich Department of Economics, State University of New York-Albany (SUNY), Albany, New York (USA)",1771.34,2
1671,Jose  Encarnacion Jr.†,1771.74,2
1672,"Jing  Zhang Economic Research Department, Federal Reserve Bank of Chicago, Chicago, Illinois (USA)",1775.19,0.5
1673,"Adam V. Reed Kenan Flagler Business School, University of North Carolina-Chapel-Hill, Chapel Hill, North Carolina (USA)",1775.92,1
1674,"Federico  Perali Dipartimento di Scienze Economiche, Facoltà di Economia, Università degli Studi di Verona, Verona, Italy",1776.41,2
