Rank,Author,Score,Students
2076,"Coralio  Ballester Departamento de Fundamentos del Análisis Económico, Facultad de Ciencias Económicas y Empresariales, Universidad de Alicante, Alicante, Spain",2169.55,2
2077,"Francisco J. Ruge-Murcia Department of Economics, McGill University, Montréal, Canada",2170.82,0.5
2078,"Richard A. Brecher Department of Economics, Carleton University, Ottawa, Canada",2170.84,1
2079,"Lawrence L Schembri Bank of Canada, Ottawa, Canada",2171.79,1
2080,"Richard  Paap Econometrisch Instituut, Faculteit der Economische Wetenschappen, Erasmus Universiteit Rotterdam, Rotterdam, Netherlands",2174.19,0.5
2081,"Robert A. Pollak Department of Economics, Washington University in St. Louis, St. Louis, Missouri (USA)Olin School of Business, Washington University in St. Louis, St. Louis, Missouri (USA)",2174.36,1
2082,"Dirk  Willenbockel Institute of Development Studies, University of Sussex, Brighton, United Kingdom",2175.21,1.5
2083,"Larry  Samuelson Economics Department, Yale University, New Haven, Connecticut (USA)",2175.77,1
2084,"Michael R Ransom Department of Economics, Brigham Young University, Provo, Utah (USA)",2176.38,0.5
2085,"Alain Jacques Chateauneuf Institut de Préparation à l'Administration et à la Gestion (IPAG), Paris, FranceParis School of Economics, Paris, France",2176.53,4
2086,"Benoit  Dostie Institut d'Économie Appliquée, HEC Montréal (École des Hautes Études Commerciales), Montréal, Canada",2176.84,1
2087,"Martin Georg Kocher Institut für Höhere Studien (IHS), Wien, Austria",2177.08,2
2088,"Pascal  Petit Centre d'Économie de l'Université Paris-Nord (CEPN), Université Paris-13, Paris, France",2177.5,0.5
2089,"Aurel  Iancu Institutul National de Cercetari Economice (INCE), Academia Romana, Bucureşti, Romania",2178.48,1
2090,"Aart  de Zeeuw https://www.tilburguniversity.edu/research/economics-and-management/graduate-school, School of Economics and Management, Universiteit van Tilburg, Tilburg, Netherlands",2179.83,0.5
2091,Stefan  Szymanski,2179.94,0.5
2092,"Miroslav  Verbic Ekonomska fakuteta, Univerza v Ljubljani, Ljubljana, Slovenia",2182.38,2
2093,"Paolo  Epifani School of Economics, University of Nottingham, Nottingham, United Kingdom",2183.96,1
2094,"Sergio S Urzua Department of Economics, University of Maryland, College Park, Maryland (USA)",2184.59,2
2095,"Daniel M. Hungerman Department of Economics, University of Notre Dame, South Bend, Indiana (USA)",2184.8,1
2096,"Siem Jan  Koopman Afdeling Econometrie and Operations Research, School of Business and Economics, Vrije Universiteit Amsterdam, Amsterdam, Netherlands",2185.21,2
2097,"Rikard  Forslid Nationalekonomiska institutionen, Stockholms Universitet, Stockholm, Sweden",2185.32,1
2098,"Matthew T. Holt Department of Agricultural and Applied Economics, Virginia Polytechnic Institute and State University (Virginia Tech), Blacksburg, Virginia (USA)",2187.44,1
2099,"Andriana  Bellou Département de Sciences Économiques, Université de Montréal, Montréal, CanadaCentre Interuniversitaire de Recherche en Analyse des Organisations (CIRANO), Montréal, Canada",2187.78,0.5
2100,"Rene  Kemp United Nations University-Maastricht Economic Research Institute of Innovation and Technology (UNU-MERIT), Maastricht, Netherlands",2187.96,1
2101,"Marla  Ripoll Department of Economics, University of Pittsburgh, Pittsburgh, Pennsylvania (USA)",2189.76,1.5
2102,"Ngo Van Long Department of Economics, McGill University, Montréal, Canada",2192.98,2
2103,"Jan K. Brueckner Department of Economics, University of California-Irvine, Irvine, California (USA)",2193.92,2
2104,"Miquel  Faig Department of Economics, University of Toronto, Mississauga, CanadaDepartment of Economics, University of Toronto, Toronto, Canada",2193.94,2
2105,"James M. Nason Department of Economics, Poole College of Management, North Carolina State University, Raleigh, North Carolina (USA)",2194.13,1.5
2106,"Francesco  Trebbi Vancouver School of Economics, University of British Columbia, Vancouver, Canada",2194.21,1
2107,"Raul V. Fabella School of Economics, University of the Philippines at Diliman, Quezon City, Philippines",2194.6,1
2108,"Marco  Bassetto Research Department, Federal Reserve Bank of Minneapolis, Minneapolis, Minnesota (USA)",2195.92,0.5
2109,"Stephen  Cecchetti Department of Economics, International Business School, Brandeis University, Waltham, Massachusetts (USA)",2198.12,2
2110,"Yvan  Lengwiler Abteilung Finanzmarkttheorie, Wirtschaftswissenschaftliches Zentrum, Universität Basel, Basel, Switzerland",2200.17,1
2111,"J. Edward  Taylor Department of Agricultural and Resource Economics, University of California-Davis, Davis, California (USA)",2201.08,0.5
2112,"Charles Yuji Horioka Research Institute for Economics and Business Administration (RIEB), Kobe University, Kobe, Japan",2202.6,1
2113,"Arnaud  Chevalier Department of Economics, Royal Holloway, Egham, United Kingdom",2203.14,1
2114,"Michael R. Ward Department of Economics, College of Business Administration, University of Texas-Arlington, Arlington, Texas (USA)",2203.8,0.5
2115,"Warren E. Weber Federal Reserve Bank of Atlanta, Atlanta, Georgia (USA)Bank of Canada, Ottawa, Canada",2204.81,1
2116,"Akiko  Suwa-Eisenmann Paris School of Economics, Paris, France",2206.52,1
2117,"Sherman  Robinson International Food Policy Research Institute (IFPRI), Washington, District of Columbia (USA)",2207.73,1.5
2118,"Miklos  Koren Department of Economics and Business, Central European University, Budapest, Hungary",2207.86,1
2119,"Tooraj  Jamasb Økonomisk Institut, Copenhagen Business School, Frederiksberg, Denmark",2208.14,0.5
2120,"Francesco  De Sinopoli Dipartimento di Scienze Economiche, Facoltà di Economia, Università degli Studi di Verona, Verona, Italy",2208.57,1.5
2121,Angus  Maddison †,2209.23,0.5
2122,"Richard T. Baillie Economics Department, Michigan State University, East Lansing, Michigan (USA)School of Economics and Finance, Queen Mary University of London, London, United Kingdom",2209.46,2
2123,"Tommaso  Valletti Dipartimento di Economia e Finanza, Facoltà di Economia, Università degli Studi di Roma ""Tor Vergata"", Roma, Italy",2210.04,0.5
2124,"Greg  Traxler Evans School of Public Policy and Governance, University of Washington, Seattle, Washington (USA)",2210.59,1
2125,"Jaya  Krishnakumar Geneva School of Economics and Management, Université de Genève, Genève, Switzerland",2212.19,2
2126,"David M  Newbery Energy Policy Research Group, Judge Business School, University of Cambridge, Cambridge, United Kingdom",2213.51,0.5
2127,"Joseph  Farrell Department of Economics, University of California-Berkeley, Berkeley, California (USA)",2214.69,1.5
2128,"Ryo  Horii Institute of Social and Economic Research (ISER), Osaka University, Osaka, Japan",2214.73,2
2129,"Michael Gerald Pollitt Energy Policy Research Group, Judge Business School, University of Cambridge, Cambridge, United Kingdom",2217.3,0.5
2130,"Martin  Ellison Department of Economics, Oxford University, Oxford, United Kingdom",2217.8,2
2131,"Neeraj  Sood Leonard D. Schaeffer Center for Health Policy and Economics, University of Southern California, Los Angeles, California (USA)",2218.67,1
2132,"Nobuaki  Hamaguchi Research Institute for Economics and Business Administration (RIEB), Kobe University, Kobe, Japan",2219.15,1
2133,"Marc F. Bellemare Department of Applied Economics, College of Agricultural, Food, and Environmental Sciences, University of Minnesota-St. Paul, St. Paul, Minnesota (USA)",2220.75,3
2134,"Pedro  Carneiro Department of Economics, University College London (UCL), London, United Kingdom",2221.46,1
2135,"Malcolm  Sawyer Leeds University Business School (LUBS), University of Leeds, Leeds, United KingdomForum for Macroeconomics and Macroeconomic Policies, Hans Böckler Stiftung, Düsseldorf, Germany",2223.36,1
2136,"Michael  Berlemann Fächergruppe Volkswirtschaftslehre, Helmut Schmidt Universität Hamburg, Hamburg, Germany",2225.94,3
2137,"Diego  Moreno Departamento de Economía, Universidad Carlos III de Madrid, Madrid, Spain",2227.3,1
2138,"James  Schummer Managerial Economics and Decision Sciences (MEDS), Kellogg Graduate School of Management, Northwestern University, Evanston, Illinois (USA)",2227.63,1
2139,Mohamed  Boutahar,2230.3,3
2140,Cem  Ertur †,2230.42,0.5
2141,"Vincenzo  Verardi Centre de Recherche en Économie de Développement (CRED), Faculté des Sciences Économiques, Sociales et de Gestion (FSESG), Université de Namur, Namur, Belgium",2231.86,0.5
2142,"Gabriel J Felbermayr Institut für Weltwirtschaft (IfW), Kiel, Germany",2233.63,2
2143,Nathan  Rosenberg †,2234.86,0.5
2144,"David  Dorn Institut für Volkswirtschaftslehre, Wirtschaftswissenschaftliche Fakutät, Universität Zürich, Zürich, Switzerland",2235.36,1
2145,"Chia-Lin  Chang Department of Applied Economics, National Chung-Hsing University, Taichung, TaiwanDepartment of Finance, National Chung-Hsing University, Taichung, Taiwan",2235.9,2
2146,"Jean-Christophe  Bureau Économie Publique, Département ECOSOCIO - Économie et Sciences Sociales pour l'Agriculture, l'Alimentation et l'Environnement (SAE2), Institut National de Recherche pour l'Agriculture, l'Alimentation et l'Environnement (INRAE), Paris-Grignon, France",2236.31,1.5
2147,"Christopher J.E. Bliss Economics Group, Nuffield College, Department of Economics, Oxford University, Oxford, United Kingdom",2236.71,0.5
2148,"Ansgar  Belke Volkswirtschaftslehre, Fachbereich Wirtschaftswissenschaften, Universität Duisburg-Essen, Essen, Germany",2237.59,1
2149,"Katarzyna  Maciejowska Katedra Badań Operacyjnych i Inteligencji Biznesowej, Politechnika Wrocławska, Wrocław, Poland",2238.03,0.5
2150,"Carsten  Helm Institut für Volkswirtschaftslehre, Carl von Ossietzky Universität Oldenburg, Oldenburg, Germany",2239.25,0.5
2151,"Marco  Battaglini Center for Analytic Economics, Department of Economics, Cornell University, Ithaca, New York (USA)",2240.14,0.5
2152,"Bruce A. McCarl Department of Agricultural Economics, Texas A&M University, College Station, Texas (USA)",2241.59,1.5
2153,"Esther  Ruiz Departamento de Estadistica, Universidad Carlos III de Madrid, Madrid, Spain",2242.77,0.5
2154,"Jesus  Ferreiro Departamento de Economía Aplicada V, Facultad de Economía y Empresa, Universidad del País Vasco - Euskal Herriko Unibertsitatea, Bilbao, Spain",2248.8,1.5
2155,"Thomas Randolph Beard Department of Economics, Auburn University, Auburn, Alabama (USA)",2251.56,0.5
2156,"Mary E. Lovely Department of Economics, Maxwell School, Syracuse University, Syracuse, New York (USA)",2252.61,0.5
2157,"Florin O. Bilbiie Départment d'économétrie et d'économie politique (DEEP), Faculté des Hautes Études Commerciales (HEC), Université de Lausanne, Lausanne, Switzerland",2253.98,0.5
2158,"Cristina  Terra Département d'Économie, ESSEC Business School, Cergy-Pontoise, France",2254.02,1
2159,"Francois  Rycx Département d'Économie Appliquée (DULBEA), Solvay Brussels School of Economics and Management, Université Libre de Bruxelles, Bruxelles, BelgiumCentre Emile Bernheim, Solvay Brussels School of Economics and Management, Université Libre de Bruxelles, Bruxelles, Belgium",2254.52,0.5
2160,"Lex  Meijdam https://www.tilburguniversity.edu/research/economics-and-management/graduate-school, School of Economics and Management, Universiteit van Tilburg, Tilburg, Netherlands",2257.86,1
2161,"Maxwell  Stinchcombe Department of Economics, University of Texas-Austin, Austin, Texas (USA)",2257.92,1.5
2162,"Alois  Guger Österreichisches Institut für Wirtschaftsforschung (WIFO), Wien, Austria",2258.23,0.5
2163,"Tobias  Kretschmer Fakultät für Betriebswirtschaft, Ludwig-Maximilians-Universität München, München, Germany",2259.35,1.5
2164,"James  Bullard Research Division, Federal Reserve Bank of St. Louis, St. Louis, Missouri (USA)",2261.26,0.5
2165,"Claude  d'Aspremont Center for Operations Research and Econometrics (CORE), Louvain Institute of data Analysis and Modelling in Economics and Statistics (LIDAM), Université Catholique de Louvain, Louvain-la-Neuve, Belgium",2261.38,0.5
2166,"Daniel  Parent Institut d'Économie Appliquée, HEC Montréal (École des Hautes Études Commerciales), Montréal, Canada",2261.69,0.5
2167,Anna Maria Falzoni,2261.71,0.5
2168,"Carmen Diana  Deere Food and Resource Economics Department, University of Florida, Gainesville, Florida (USA)",2262.44,1
2169,"Matthieu  Bussiere Banque de France, Paris, France",2267.14,2.5
2170,"Pierre-Olivier  Weill Department of Economics, University of California-Los Angeles (UCLA), Los Angeles, California (USA)National Bureau of Economic Research (NBER), Cambridge, Massachusetts (USA)",2267.52,1
2171,"Michael  Neugart Fachbereich Rechts- und Wirtschaftswissenschaften, Technische Universität Darmstadt, Darmstadt, Germany",2268.14,0.5
2172,"A. Ozlem  Onder İktisat Bölümü, İktisadi ve İdari Bilimler Fakültesi, Ege Üniversitesi, İzmir, Turkey",2268.65,2
2173,"Ian Peter Preston Department of Economics, University College London (UCL), London, United Kingdom",2268.71,1
2174,"Maurice  Salles Centre de Recherche en Économie et Management (CREM), Rennes/Caen, France",2269.61,0.5
2175,"Francesco  Bartolucci Dipartimento di Economia, Università degli Studi di Perugia, Perugia, Italy",2272.19,2
2176,"Harold  Houba Afdeling Econometrie and Operations Research, School of Business and Economics, Vrije Universiteit Amsterdam, Amsterdam, NetherlandsTinbergen Instituut, Amsterdam, Netherlands",2272.5,0.5
2177,"Marek  Gora Katedra Ekonomii I, Szkoła Główna Handlowa w Warszawie, Warszawa, Poland",2272.77,1
2178,"Maria  Saez-Marti Institut für Volkswirtschaftslehre, Wirtschaftswissenschaftliche Fakutät, Universität Zürich, Zürich, Switzerland",2273.03,1
2179,"Miana  Plesca Department of Economics and Finance, Gordon Lang School of Business and Economics, University of Guelph, Guelph, Canada",2273.44,2
2180,"Bas  Donkers Faculteit der Economische Wetenschappen, Erasmus Universiteit Rotterdam, Rotterdam, Netherlands",2274.34,0.5
2181,"Jan  Potters https://www.tilburguniversity.edu/research/economics-and-management/graduate-school, School of Economics and Management, Universiteit van Tilburg, Tilburg, Netherlands",2277.05,1
2182,"Koichiro  Kamada Faculty of Business and Commerce, Keio University, Tokyo, Japan",2278.21,1
2183,"Todd A. Sorensen Economics Department, University of Nevada-Reno, Reno, Nevada (USA)",2278.44,2
2184,"Fuad  Aleskerov International Laboratory of Decision Choice and Analysis, National Research University Higher School of Economics, Moscow, RussiaFaculty of Economics, National Research University Higher School of Economics, Moscow, Russia",2280.03,7
2185,Julio J. Rotemberg †,2280.12,0.5
2186,"Philippe  De Donder Toulouse School of Economics (TSE), Toulouse, France",2280.34,0.5
2187,"Francois Paul Maniquet Center for Operations Research and Econometrics (CORE), Louvain Institute of data Analysis and Modelling in Economics and Statistics (LIDAM), Université Catholique de Louvain, Louvain-la-Neuve, Belgium",2280.96,1
2188,"C. N.  Teulings Faculteit Economie en Bedrijfskunde, Universiteit van Amsterdam, Amsterdam, Netherlands",2281.77,1
2189,"Aaron  Tornell Department of Economics, University of California-Los Angeles (UCLA), Los Angeles, California (USA)",2282.39,0.5
2190,"Dimitris  Georgoutsos Department of Accounting and Finance, Athens University of Economics and Business (AUEB), Athens, Greece",2282.71,1
2191,"Elie  Appelbaum Department of Economics, York University, Toronto, Canada",2286.01,0.5
2192,"James M. Snyder Jr.Economics Department, Massachusetts Institute of Technology (MIT), Cambridge, Massachusetts (USA)",2290.23,1
2193,"James Byron Davies Department of Economics, University of Western Ontario, London, Canada",2291.46,1.5
2194,"Albert  Park Department of Economics, Business School, Hong Kong University of Science and Technology (HKUST), Kowloon, Hong Kong",2292.96,0.5
2195,"Don  Harding Centre of Policy Studies and Impact Project (COPS), Victoria University, Melbourne, Australia",2293,0.5
2196,"Sam  Bucovetsky Department of Economics, York University, Toronto, Canada",2293.73,0.5
2197,Kimberly S. Rollins,2294.58,0.5
2198,"Dominique  Lepelley Centre d'Économie et de Management de l'Océan Indien (CEMOI), Faculté de Droit et de Sciences Économiques et Politiques, Université de la Réunion, St-Denis, Réunion",2294.61,0.5
2199,"Enrico  Perotti Finance Group, Faculteit Economie en Bedrijfskunde, Universiteit van Amsterdam, Amsterdam, Netherlands",2295.17,1
2200,"Bradley  Ruffle Department of Economics, McMaster University, Hamilton, Canada",2295.87,1.5
2201,"Warren C. Sanderson Economics Department, Stony Brook University - SUNY, Stony Brook, New York (USA)",2298.02,0.5
2202,"John C. Quiggin Risk and Sustainable Management Group (RSMG), School of Economics, University of Queensland, Brisbane, Australia",2298.15,2
2203,"Olivier  Donni Théorie Économique, Modélisation, Application (THEMA), Université de Cergy-Pontoise, Cergy-Pontoise, France",2298.96,1.5
2204,"Bruno  Jossa Dipartimento di Teoria Economica e Applicazioni, Università degli Studi di Napoli - ""Federico II"", Napoli, Italy",2299.33,1
2205,"Mehmet Ali Ulubasoglu Department of Economics, Business School, Deakin University, Melbourne, Australia",2300.51,5
2206,"Teresa M.  Garcia-Munoz Departamento de Métodos Cuantitativos para la Economía y la Empresa, Facultad de Ciencias Económicas y Empresariales, Universidad de Granada, Granada, SpainGranada Lab of Behavioral Economics (GLOBE), Facultad de Ciencias Económicas y Empresariales, Universidad de Granada, Granada, Spain",2301.39,0.5
2207,Erik  Biorn †,2302.16,1
2208,"Yan  Bai Economics Department, University of Rochester, Rochester, New York (USA)",2303.29,1
2209,"Leopoldo  Fergusson Centro de Estudios Sobre Desarrollo Económico (CEDE), Facultad de Economía, Universidad de los Andes, Bogotá, ColombiaFacultad de Economía, Universidad de los Andes, Bogotá, Colombia",2303.35,2
2210,"Frederic  Koessler Paris School of Economics, Paris, France",2303.61,0.5
2211,"Roman  Inderst Abteilung Finanzen, Fachbereich Wirtschaftswissenschaft, Goethe Universität Frankfurt am Main, Frankfurt am Main, Germany",2304.31,1
2212,"Mark R. Montgomery Economics Department, Stony Brook University - SUNY, Stony Brook, New York (USA)",2306.13,0.5
2213,"Dimitris  Korobilis Department of Economics, Adam Smith Business School, University of Glasgow, Glasgow, United Kingdom",2306.19,2.5
2214,"Marcus  Asplund Økonomisk Institut, Copenhagen Business School, Frederiksberg, Denmark",2307.23,0.5
2215,"Andrew  Beauchamp Economics Department, Wright State University, Dayton, Ohio (USA)",2307.54,0.5
2216,"Kevin Daniel Sheedy Economics Department, London School of Economics (LSE), London, United KingdomCentre for Macroeconomics (CFM), London, United Kingdom",2307.89,1
2217,"Gianluca  Fiorentini Dipartimento di Scienze Economiche, Alma Mater Studiorum - Università di Bologna, Bologna, Italy",2308.96,1
2218,"Jens  Suedekum Düsseldorf Institute for Competition Economics (DICE), Wirtschaftswissenschaftliche Fakultät, Heinriche-Heine-Universität Düsseldorf, Düsseldorf, Germany",2309.26,2
2219,"Walter  Beckert Department of Economics, Mathematics and Statistics, Birkbeck College, London, United Kingdom",2311.01,0.5
2220,"Robert Alan Jones Department of Economics, Simon Fraser University, Burnaby, Canada",2311.39,1
2221,"Ioana R. Moldovan Department of Economics, Adam Smith Business School, University of Glasgow, Glasgow, United Kingdom",2311.44,0.5
2222,William J. Baumol †,2311.64,1
2223,"Richard G. Pierse National Institute of Economic and Social Research (NIESR), London, United Kingdom",2313.1,0.5
2224,"Mette  Ejrnaes Økonomisk Institut, Københavns Universitet, København, Denmark",2314.63,1
2225,"Dilip  Mookherjee Institute for Economic Development, Department of Economics, Boston University, Boston, Massachusetts (USA)",2316.65,1
2226,"Luiz Renato Lima Department of Economics, College of Business, University of Tennessee-Knoxville, Knoxville, Tennessee (USA)",2316.71,0.5
2227,"Antonio Brandao Moniz Inovação e Estudos de Tecnologia (IET), Centro Interdisciplinar de Ciências Sociais (CICS.NOVA), Faculdade de Ciências Sociais e Humanas, Universidade Nova de Lisboa, Lisboa, Portugal",2316.8,13.5
2228,"Arne  Hallam Department of Economics, Iowa State University, Ames, Iowa (USA)",2319.66,0.5
2229,"Gabor  Bekes Department of Economics and Business, Central European University, Budapest, Hungary",2319.86,0.5
2230,"Nicholas  Crafts Department of Economics, University of Warwick, Coventry, United Kingdom",2319.96,1
2231,"Aurora  Garcia-Gallego Departament d'Economia, Universitat Jaume I, Castellón de la Plana, SpainLaboratori d'Economia Experimental (LEE), Universitat Jaume I, Castellón de la Plana, Spain",2320.33,1.5
2232,"Alexandre  Dmitriev Department of Economics, Business School, University of Auckland, Auckland, New Zealand",2320.66,1
2233,"Joao  Correia-da-Silva Faculdade de Economia, Universidade do Porto, Porto, Portugal",2322.37,4
2234,"Hiroshi  Ono Graduate School of International Corporate Strategy, Business School, Hitotsubashi University, Tokyo, Japan",2322.64,1
2235,"Luigi  Guiso Istituto Einaudi per l'Economia e la Finanza (EIEF), Roma, Italy",2323.01,0.5
2236,"Sumner Jonathan La Croix Department of Economics, University of Hawaii-Manoa, Manoa, Hawaii (USA)",2324.58,2
2237,"Rebecca M. Blank National Bureau of Economic Research (NBER), Cambridge, Massachusetts (USA)Institute of Labor Economics (IZA), Bonn, Germany",2325.73,0.5
2238,"Cees  Withagen Institut de Préparation à l'Administration et à la Gestion (IPAG), Paris, France",2325.75,0.5
2239,"Eckhard  Platen Finance Discipline Group, Business School, University of Technology Sydney, Sydney, AustraliaQuantitative Finance Research Centre, Finance Discipline Group, Business School, University of Technology Sydney, Sydney, Australia",2325.9,2
2240,Andre  Farber †,2326.4,0.5
2241,"Ronald Patrick Smith Department of Economics, Mathematics and Statistics, Birkbeck College, London, United Kingdom",2326.87,0.5
2242,"Robert J. Willis Economics Department, University of Michigan, Ann Arbor, Michigan (USA)",2327.55,0.5
2243,"Alfonso  Herranz-Loncan Departament d'Història Econòmica, Institucions, Política i Economia Mudial, Facultat d'Economia i Empresa, Universitat de Barcelona, Barcelona, SpainFacultat d'Economia i Empresa, Universitat de Barcelona, Barcelona, Spain",2328.12,3
2244,"Wolf  Wagner Department of Finance, Rotterdam School of Management (RSM Erasmus University), Erasmus Universiteit Rotterdam, Rotterdam, Netherlands",2329.28,0.5
2245,"Jean-Benoit  Zimmermann Groupement de Recherche en Économie Quantitative d'Aix-Marseille (GREQAM), École d'Économie d'Aix-Marseille, Aix-Marseille Université, Marseille, France",2329.44,0.5
2246,"Joao Victor Issler EPGE Escola Brasileira de Economia e Finanças, Fundação Getúlio Vargas (FGV), Rio de Janeiro, Brazil",2329.51,0.5
2247,"Marco Eugenio Carlo Vannini Centro Ricerche Nord Sud (CRENoS), Italy",2330.52,0.5
2248,"Rajneesh  Narula Henley Business School, University of Reading, Reading, United Kingdom",2330.55,0.5
2249,"A. Michael Spence Economics Department, Stern School of Business, New York University (NYU), New York City, New York (USA)",2330.78,0.5
2250,Lars  Clausen †,2331.23,0.5
2251,"Joachim Klaus Winter Volkswirtschaftliche Fakultät, Ludwig-Maximilians-Universität München, München, Germany",2333.41,1.5
2252,"Roger  Vickerman School of Economics, University of Kent, Canterbury, United Kingdom",2334.13,2
2253,"Patrick  Moyes Groupe de Recherche en Économie Théorique et Appliquée (GREThA), Université de Bordeaux, Bordeaux, France",2335.07,1
2254,"Peter  Norman Department of Economics, University of North Carolina-Chapel-Hill, Chapel Hill, North Carolina (USA)",2339.36,1
2255,"Shyam  Sunder School of Management, Yale University, New Haven, Connecticut (USA)",2339.63,1
2256,"John  Tsoukalas Department of Economics, Adam Smith Business School, University of Glasgow, Glasgow, United Kingdom",2340.44,0.5
2257,"Harry P. Huizinga Departement Algemene Economie, School of Economics and Management, Universiteit van Tilburg, Tilburg, Netherlands",2341.56,0.5
2258,"Jean-Marie  Baland Centre de Recherche en Économie de Développement (CRED), Faculté des Sciences Économiques, Sociales et de Gestion (FSESG), Université de Namur, Namur, Belgium",2341.6,1.5
2259,"Yu  Xie Institute for Social Research (ISR), University of Michigan, Ann Arbor, Michigan (USA)",2343.5,1
2260,"Ruthira  Naraidoo Department of Economics, Faculty of Economic and Management Sciences, University of Pretoria, Pretoria, South Africa",2343.59,1.5
2261,"Hans  Linnemann Afdeling Ontwikkelings Economie, School of Business and Economics, Vrije Universiteit Amsterdam, Amsterdam, Netherlands",2343.71,1
2262,"Christopher M. Meissner Economics Department, University of California-Davis, Davis, California (USA)",2344.78,0.5
2263,"Marios  Zachariadis Department of Economics, Faculty of Economics and Management, University of Cyprus, Nicosia, Cyprus",2346.48,4
2264,"Mathan  Satchi School of Economics, University of Kent, Canterbury, United Kingdom",2349.91,0.5
2265,"James C. Cox Experimental Economics Center, Department of Economics, Andrew Young School of Policy Studies, Georgia State University, Atlanta, Georgia (USA)",2351.11,0.5
2266,"Christopher S. Cotton Economics Department, Queen's University, Kingston, Canada",2351.44,2
2267,"Constantinos Petros Katrakilidis Department of Economics, Aristotle University of Thessaloniki, Thessaloniki, Greece",2352.23,1
2268,"Wilfried  Altzinger WU Wirtschaftsuniversität Wien, Wien, Austria",2352.3,0.5
2269,"Hideo  Konishi Department of Economics, Boston College, Chestnut Hill, Massachusetts (USA)",2352.36,2
